Precio,Ubicación,Ciudad,Expensas,Habitaciones,Baños,Área,Estacionamientos,Precio/m²,Fecha de Publicación,Descripción,Logo Agencia,Destacado
USD 285.000,Renta O Venta  Departamento 3 Dormitorios - Cumbayá,"Cumbayá, Quito",N/A,3 hab.,N/A,170 m² tot.,N/A,N/A,N/A,"Venta O renta departamento de 3 dormitorios - en uno de los edificios más modernos de cumbayá Si buscas exclusividad, amplitud, amenities de primera, seguridad, ubicación estratégica. entonces esta es la mejor opción! *Ubicado en una de las mejores zonas de Cumbayá*A 2 minutos de la San Francisco y Paseo San Francisco, a 5 minutos del parque de Cumbayá, a 5 minutos del Scala Shopping*En el 4to piso de un edificio súper moderno, tipo club por sus amenities*Guardianía las 24 horasCaracterísticas del departamento*Departamento de 170m2 de construcción*Amplia área social con salida al balcón*Cocina estilo americano con muebles altos y bajos, plancha y extractor empotrados*3 dormitorios amplios con clósets, todos con baño completo*Un baño social *Cuarto de lavandería *Balcón amplio con linda vista al potrero*2 parqueaderos *1 bodega *Cortinas e iluminación en todo el departamentoEl edificio tiene los siguientes amenities: *Patinaje en hielo*Pista de bolos*Music room con varios instrumentos*Mini golf*Cines (3) *Kids club*Teens area*Game room*Cancha de tenis*Cancha de fútbol*Canchas squash (2) *Área de Yoga*Spa, Turco, Sauna, Jacuzzi (2) Piscinas*Gimnasio totalmente equipado*Área de peluquería+Área de barber shop*Pet spa*Solárium*Salón comunal y eventos*Business center*Salas de reuniones",./Plusvalia_raw_p1_060924_2243_files/logo_amg-inmobiliaria_1695676496160.jpg,Super destacado
USD 146.837,General Eloy Alfaro Cumbaya a Pocos Minutos del Paseo,"Cumbayá, Quito",N/A,2 hab.,N/A,100 m² tot.,N/A,N/A,N/A,"Hermosos departamentos en venta de 2 habitaciones desde $146. 837. Tienen amplias áreas exteriore como terrazas o jardín, cocina estilo americana, sala comedo integradas, Departamentos con linda luz natural a minutos del Paseo San Francisco. En una de las mejores zonas de Cumbayá, tu departamento te está esperando. El edificio cuenta con Gimansio equipado, área bbq panorámica, jacuzzi, sala de coworking, firepit, yoga deck, pet zone y todo digitalizado. Últimos 2 disponiblesApartamento 4Primer piso71m2 de área útil13. 2m2 de terraza23. 40m2 de jardín$146. 837Apartamento 6Primer piso81m2 de área útil90. 56m2 de terraza$164. 355Llámanos para agendar una visitaInmoweb siempre contigo en los mejores momentosNuestra misión es acompañar a nuestros clientes en una de las decisiones más difíciles de su vida: Comprar su vivienda",./Plusvalia_raw_p1_060924_2243_files/logo_inmoweb_1696697632164.jpg,Super destacado
USD 95.000,De los Laureles,"Centro Norte, Quito",N/A,3 hab.,N/A,85 m² tot.,N/A,N/A,N/A,"Edificio con seguridad privada 24 horas con cámaras - Gimnasio- Piscina- Lounge Bar- Juego para niños- Parqueadero para 1 autoDepartamento: - 3 dormitorios- 2 baños completos- Cocina estilo americana incluye cocina, horno, filtro de agua- Persianas y lámparasEl edificio se encuentra en un sector estratégico, cerca a la udla y a estaciones de buses",./Plusvalia_raw_p1_060924_2243_files/logo_plusvalia.com_1507668542761.jpg,Super destacado
USD 43.000,San Isidro del Inca,"Centro Norte, Quito",N/A,2 hab.,N/A,58 m² tot.,N/A,N/A,N/A,"Domus vende departamento ubicado en la calle De Los Nogales, San Isidro del Inca, Centro-Norte de Quito. Piso 2. Consta de 2 dormitorios. Un baño completo. tiene una cocina tipo americana, abierta, con desayunador, mesones de granito. Área de máquinas con piedra de lavar. Sala-comedor. Los pisos son de cerámica en áreas húmedas y piso flotante en las demás áreas. descripción de las áreas comunales. - 2 salones comunales. - Área verde. - Parqueaderos de visita. - Puertas eléctricas con acceso biométrico. Ventajas. – Puertas automáticas de avanzada. La alícuota es de $20 e incluye la limpieza del edf. El mantenimiento del mismo el agua comunal y la luz comunal. Datos irm. Área departamento: 58, 13 m2. No cuenta con Parqueadero. El conjunto tiene parqueaderos de visitas. Precio de remate: $43. 000. Años de construcción: 9. No tiene garage. Informes Domus gestion inmobiliaria, Veracruz y Naciones Unidas",./Plusvalia_raw_p1_060924_2243_files/logo_bienes-raices-ecuador_1615386724913.jpg,Super destacado
USD 156.000,"Vista Grande, Calle Eugenio Espejo","Miravalle, Quito",N/A,2 hab.,N/A,154 m² tot.,N/A,N/A,N/A,"Vendo hermoso departamento en urbanización Vista Grande. Vista hasta el Cotopaxi. excelente ubicación, sector Miravalle. 124, 95 m2 netos. 1 estacionamiento No. 8 con 13, 50 m2. 1 estacionamiento No. 10 con 13, 50 m2. 1 bodega No. 6 con 3 m2. Total 154 m2. 1 bodega. el departamento está en planta baja, son 6 departamentos. el departamento es muy luminoso y soleado. grandes ventanales para vistas y luminosidad. el departamento está en perfectas condiciones. area social. puerta amplia moderna. Recibidor. Sala - Comedor muy amplios con mucha luz natural. Cocina cerrada muy amplia, mesones de granito. Desayunador. Muebles con gran capacidad de almacenaje. ventanales para iluminación y ventilación natural. Cocina a gas, horno eléctrico empotrado y extractor de olores. área familiar. Salita. Dormitorio principal luminoso. closet en perfecto estado, de pared a pared. Baño principal amplio con cabina y ventilación natural. Dormitorio 2 muy amplio, luminoso con gran ventanal. para cama de 3 plazas y área de estudio. Closet amplio de pared a pared. Baño completo 2 con cabina. Área de máquina para lavadora, secadora en paralelo, lavandín y espacio de planchado. Mueble aéreo para líquidos de limpieza. Cortinas nuevas en todas las ventanas. adicionales. 2 estacionamiento cubiertos paralelos. 1 bodega amplia. La Urbanización tiene alta seguridad las 24 horas de empresa, con varios guardias permanentes. Excelente administración. Parque de 3 hectáreas con varias canchas, juegos infantiles, senderos. precio $ 156. 000",./Plusvalia_raw_p1_060924_2243_files/logo_martha-castillo_1611363192695.jpg,Super destacado
USD 118.000,Bosque,"El Bosque , Quito",N/A,3 hab.,N/A,135 m² tot.,N/A,N/A,N/A,"¡Oportunidad Única en El Bosque! Venta de Departamento Moderno con Acabados de Lujo. Descubre la vida en uno de los sectores más exclusivos de la ciudad con este hermoso departamento de 105 m², diseñado para brindarte el máximo confort y elegancia. ¡No dejes pasar esta excelente oportunidad de inversión! Vive en el confort y exclusividad que solo el sector El Bosque puede ofrecer. Descripción del inmueble: - Área Total: 105 m² (100 m² de construcción + 5 m² de balcón) - Ambientes Amplios: Sala y comedor integrados, perfectos para recibir a familiares y amigos. - Cocina Americana: Con muebles altos y bajos, y un acogedor comedor diario. - Dormitorios: 3 espaciosos dormitorios para toda la familia. - Baños: 2 completos con acabados modernos. - Comodidad Total: 2 parqueaderos y área de máquinas. Amenidades del edificio: - Diversión y Convivencia: 2 salones comunales y áreas de juegos infantiles. - Seguridad Permanente: Guardianía 24 horas para tu tranquilidad. - Servicios Centralizados: Agua caliente centralizada, contadores de gas, luz y agua fría. Precio de venta: $118, 000 usd. ¡Libre de gravámenes! Contáctanos ahora para obtener más información y agendar una visita. ¡Estamos aquí para ayudarte a encontrar tu hogar ideal!",./Plusvalia_raw_p1_060924_2243_files/logo_sky-home-inmo_1529426900852.jpg,Super destacado
USD 118.000,"CUMBAYA, UNIVERSIDAD SAN FRANCISCO","Cumbayá, Quito",N/A,2 hab.,N/A,135 m² tot.,N/A,N/A,N/A,Lindo departamento con espectacular iluminacion. dentro de urbanizacion con seguridad 24/7. magnificas areas comunales. piscina temperada. area de juegos infantiles. parque. gimnasio. area de eventos. parqueaderos para visitas. area construccion: 135M2. 2 dormitorios. 2 baños completos. sala. comedor. cocina equipada con plancha - extractor de olores Y horno. terraza. 1 parqueadero cubierto. 1 bodega,./Plusvalia_raw_p1_060924_2243_files/logo_inmodaz_1568613822115.jpg,Super destacado
USD 111.500,"Calle Eugenio Espero, Tanda, Cumbaya","Cumbayá, Quito",N/A,2 hab.,N/A,125 m² tot.,N/A,N/A,N/A,"Vendo departamentos nuevos por estrenar en Tanda a 5 minutos de miravalle sobre la vía principal. Departamentos de dos y tres habitaciones con patio interno, sala comedor cocina dos habitaciones dos baños completos. 1 garaje 1 bodega área de secado. Entrega inmediata aceptamos crédito hipotecario. Citas y mayor información favor comunicarse Ver datos",./Plusvalia_raw_p1_060924_2243_files/logo_inmomak_1673986953741.jpg,Super destacado
USD 159.000,CUMBAYA,"Cumbayá, Quito",N/A,2 hab.,N/A,90 m² tot.,N/A,N/A,N/A,Kanda inmobiliaria vende: ( favor comunicarse exclusivamente solo clientes interesados) ( favor comunicarse exclusivamente solo clientes interesados) cumbaya vendo departamento nuevo de lujo 2 dormitorios con una linda vista. acabados de primera. en edificio con piscina temperada. lindas areas verdes. guardiania las 24 horas. ascensor. 2 parqueaderos. 1 bodega. parqueadero de visitas. fabulosa ubicacion. estimado cliente para mayor informacion comunicarse con maria anda al Ver datos,./Plusvalia_raw_p1_060924_2243_files/logo_kanda-inmobiliaria_1551244563700.jpg,Super destacado
USD 107.903,Avenida ilaló & San Juan De Dios,"San Rafael, Quito",N/A,2 hab.,N/A,93 m² tot.,N/A,N/A,N/A,"- Departamentos de 2 y 3 habitaciones: Habitaciones con baño privado. Master con Walking Closeth. Amplios espacios de sala y comedor. Cocina de diseño moderno. Baño social. Cocina. Opción de balcón o espacio verde, según la ubicación. - Infraestructura del Edificio: 58 departamentos exclusivos. Ascensor de última tecnología. Tres subsuelos destinados a parqueaderos y bodegas. - Locales Comerciales: Situados en los niveles S1 y S2. Cuatro locales disponibles en S1. Parqueaderos para visitas y residentes en S3. Bodegas de almacenamiento. Montacargas y escaleras de acceso. - Amenidades en la Terraza del Sexto Piso: Jardines amplios y bien cuidados. Área de bbq para eventos sociales. Zona de lectura tranquila. Sala de juegos para entretenimiento. Zona de juegos infantiles segura. Zona de fogata para reuniones nocturnas. Sala comunal para eventos. Gimnasio completo. Áreas de bienestar con turco, sauna e hidromasaje. - Ubicación Destacada: Paseo Ilaló está estratégicamente ubicado en la avenida principal, ofreciendo vistas espectaculares al Volcán Ilaló y un entorno natural privilegiado. Contacto: Para consultas y visitas, consulta por los descuentos, comuníquese con nosotros mediante WhatsApp Ver datos",./Plusvalia_raw_p1_060924_2243_files/logo_grupo-evra_1704224040427.jpg,Super destacado
