Precio,Ubicación,Ciudad,Expensas,Habitaciones,Baños,Área,Estacionamientos,Precio/m²,Fecha de Publicación,Descripción,Logo Agencia,Destacado
USD 117.000,Tnte. Gonzalo Galo y Gonzalo Benitez,"Centro Norte, Quito",USD 1 Alícuota,2 a 3 hab.,4 baños,61 a 100 m² tot.,2 estac.,N/A,N/A,Desde 85 m2 hasta 99 m2 de construcción. Hall de entrada. Sala / Comedor. Baño de visitas. Cocina estilo americana. Área de lavandería. Dormitorio master con baño completo. Dormitorio auxiliar con baño completo. Baño completo para visitas. 1 Estacionamiento. 1 Bodega. Guardianía 24/7. - Terrazas. - Área bbq. - Salón comunal. - Sala de juegos. - Salones lounge. - Gimnasio. - Área de niños. Por el día del padre la compra que se realice en el mes de junio el departamento se entregará con: -Horno. -Plancha a inducción. -Campana. -Cortinas. ¡Te esperamos!,./Plusvalia_raw_p1_060924_2243_files/logo_inmobusiness-s.a._1694815287277.jpg,Super destacado
USD 190.410,"QHGM+722, Quito 170184","Cumbayá, Quito",,2 a 3 hab.,2 baños,165 a 393 m² tot.,2 estac.,N/A,N/A,"Para ti que te gusta la conexión con la naturaleza y quieres la mejor vista de cumbayá. Akana, urbanización de casas realmente independientes con jardines privados y 2 o 3 parqueaderos individuales. En akana puedes personalizar tu hogar. - Casas de 3 y 4 dormitorios. - Departamentos de 2 y 3 dormitorios. Áreas recreativas: -Piscina. -Gimnasio. - Senderos. - Zona bbq. - Área para mascotas. - Firepit. ¡pregunta por nuestro financiamiento! Siempre pensando en tu bienestar, akana te ofrece un espacio seguro y tranquilo. Metroeje Constructora.",./Plusvalia_raw_p1_060924_2243_files/logo_metroeje_1715290505758.jpg,Super destacado
USD 66.000,Pomasqui,"Mitad del Mundo, Quito",USD 190 Alícuota,3 hab.,3 baños,69 m² tot.,2 estac.,N/A,N/A,"¿Listo para hacer realidad tu sueño de tener vivienda propia? No lo pienses más, reserva tu nueva casa o departamento en Portón de Málaga ii con solo $500. Reserva tudepartamento Y aprovecha nuestros bonos. Excelente ubicación al norte de Quito, Pomasqui, cerca de importantes vías principales como la Av. Manuel Córdova Galarza y la Av. Simón Bolívar. Cerca de supermercados (Supermaxi), escuelas y colegios, a 500 m de Cemexpo. Cómodas casas de 84m2 - Entrega inmediata. • 3 plantas más un patio y estacionamientos. • 3 habitaciones. • Sala. • Comedor. • Cocina cerrada. • 2 baños completos. • 1 baño social. • 1 estacionamiento. Cómodos departamentos de 69m2 - Entrega inmediata. • 3 habitaciones. • Sala. • Comedor. • Cocina cerrada. • 2 baños completos. • 1 estacionamiento. exclusivas áreas comunales. • Piscina. • Áreas verdes. • Mini golfito. • Área de bbq. • Cancha de césped sintético - uso múltiple. • Salón comunal. • Control de accesos vehicular y peatonal. • Piscina. • Área de fogata. financiamiento flexible. • 5% de Reserva. • 95% con crédito hipotecario vip. Aprovecha nuestras promociones",./Plusvalia_raw_p1_060924_2243_files/logo_construecuador-s.a._1598455518512.jpg,Super destacado
USD 101.661,Cumbaya,"Cumbayá, Quito",,1 a 3 hab.,2 baños,47 a 201 m² tot.,2 estac.,N/A,N/A,"¡Nuevo proyecto en el corazón de Cumbayá! Suites y dptos de 2 y 3 dormEntrega Enero 2027SuitesDesde 47, 45 m2 con 4, 47 m2 de área exterior$ 101. 661Departamentos de 2 dormitoriosDesde 114, 08 m2 con 17, 06 m2 de terraza exterior$ 219. 235Departamentos de 3 dormDesde 187, 8 m2 con 32, 5 m2 de terraza exterior$ 341. 276Excelente ubicación en CumbayáÁrea bbqgimnasioJacuzziÁreas Verdes y Fire PitSala tvárea de yogaKids zone¡Calidad de vida en Cumbayá, cerca de lo que más te importa!",./Plusvalia_raw_p1_060924_2243_files/logo_grupo-3-inversiones_6.jpg,Super destacado
USD 71.973,José Paredes y Otero sector Entre el Bosque y  el pinar,"El Bosque , Quito",USD 40 Alícuota,1 a 3 hab.,3 baños,51 a 104 m² tot.,1 estac.,N/A,N/A,"El ""Bosque Apartaments"" es un edificio de 42 exclusivas unidades de vivienda, compuesta de: mini suits, suits, departamentos de 2 y 3 dormitorios y departamentos con patio, de estilo moderno y vanguardista, diseñadas para satisfacer las necesidades que la vida moderna exige. Descubra la oportunidad de integrarse a un proyecto residencial aún en planos, situado en la zona residencial de la Brasil, reconocida por su seguridad y excelente conectividad. -Comprar en planos no solo asegura que su hogar sea exactamente como lo imagina, sino que también representa una inversión inteligente. - Al adquirir una propiedad antes de su finalización, se beneficia de precios competitivos y la posibilidad de un aumento en el valor del inmueble a lo largo del tiempo. -Aquí, cada espacio, desde Mini Suites hasta departamentos de 3 dormitorios, está diseñado para ofrecer el máximo confort y funcionalidad. Ubicación. La proximidad a servicios esenciales, como un importante centro comercial y accesos a vías de transporte principales, garantiza una vida diaria cómoda y sin complicaciones. Su familia disfrutará de la facilidad de tener todo al alcance, en un entorno que soporta tanto el crecimiento profesional como el personal. Amenitiies. El Proyecto cuenta con amenidades pensadas para enriquecer su estilo de vida, incluyendo: -Jardines tranquilos para el disfrute de los pequeños. -una terraza ideal para eventos sociales con vistas inspiradoras. -área de bbq perfecta para disfrutar momentos memorables con seres queridos. -gimnasio equipado facilita mantener un estilo de vida activo y saludable. -área húmeda para su relajamiento personal. -área de yoga. -Pet Friendly. Beneficios compra en planos. -Selección de los mejores departamentos. -Facilidades de pago flexibles y a largo plazo. -Reserva con mínima inversión. -Descuentos especiales por pronto pago. -Alta plusvalía. -Asesoramiento financiero personalizado. ¡¡Quieres aprovechar los extraordinarios beneficios de la compra en planos. ¡,!! Llena tus datos ahora en el formulario anexo y estaremos prestos a atenderte.",./Plusvalia_raw_p1_060924_2243_files/logo_inmoplus_1714065974618.jpg,Super destacado
USD 57.200,Quitumbe Ñan,"Quitumbe, Quito",USD 99 Alícuota,2 a 3 hab.,2 baños,63 a 88 m² tot.,1 estac.,N/A,N/A,"Andaluza es un conjunto privado de casas y departamentos en Quitumbe, la mejor zona del sur de Quito. Diseñado para promover un estilo de vida tranquilo y seguro, permitiendo fácil acceso a servicios y comodidades cercanas. Ubicado a pocos minutos de los principales centros comerciales (Quicentro Sur), entidades gubernamentales (Plataforma. Gubernamental Sur), Supermercados (Santa María, Mini, Tuti, Supermaxi), parques (Las Cuadras), estaciones de transporte. (Metro, trole, Terminal Terrestre de Quitumbe), bancos, colegios y universidades. Está diseñado para superar tus expectativas, cuenta con una garita de seguridad y extraordinarias áreas comunales, pensadas en el confort y la felicidad familiar: • Cancha de fútbol. • Cancha de uso múltiple. • Área de juegos infantiles. • Club House. • Área de bbq. • Gimnasio equipado. • Caminerías. • Estacionamientos de visitas. Reserva con tu casa o departamento con $500.",./Plusvalia_raw_p1_060924_2243_files/logo_construecuador-s.a._1598455518512.jpg,Super destacado
USD 52.000,Huiragchuros y Razu Razu,"Pomasqui, Quito",USD 250 Alícuota,2 a 3 hab.,4 baños,56 a 101 m² tot.,2 estac.,N/A,N/A,"Disfruta de un club privado. Departamentos de 1, 2 y 3 habitaciones en Pomasqui. Casas de 3 plantas con patio posterior y terraza. Portón de Sevilla es una opción contemporánea pensada para jóvenes familias que buscan un mejor futuro. Ubicado en Pomasqui, a 7 minutos de centros educativos, supermercados (Supermercados Aki, Santa María, Supermaxi, Hipermarket), centros recreativos y deportivos, centros comerciales (El Portal Shopping, Pomasqui Plaza) y sus principales vías de acceso (Simón Bolívar, Manuel Córdova Galarza). En Portón de Sevilla encontrarás tu departamento y tu club con las mejores áreas recreativas para distracción y descanso: - Piscina para niños y adultos. - Sala lounge apergolada. - Cancha de césped sintético. - Casa club. - Gimnasio equipado. - Senderos ajardinados. - Áreas de bbq. - Área de juegos infantiles. - Garita para guardianía con accesos controlados. - Estacionamiento de visitas. financiamiento flexible. • 5% Entrada. • 95% con Crédito Hipotecario vis",./Plusvalia_raw_p1_060924_2243_files/logo_construecuador-s.a._1598455518512.jpg,Super destacado
USD 126.640,"QHHV+GVM Quito, cumbaya","Cumbayá, Quito",,1 a 3 hab.,2 baños,110 a 400 m² tot.,2 estac.,N/A,N/A,"Tu nuevo lugar favorito. Espectacular proyecto de departamentos, diseñados en función del bienestar, comodidad y privacidad de nuestros clientes. Somos un proyecto pet friendly, ubicados a pocos minutos de Pacho Salas. Departamentos totalmente privados para disfrutar de esos momentos especiales con tus seres queridos. ¡consulta por nuestro financiamiento! -Departamentos con uno, dos y tres dormitorios. -Sala exterior con chimenea. -Altura piso-techo superior a la estándar. tawa te da más privacidad. -Departamentos completamente Insonorizados. -2 parqueaderos por departamento. -Acabados de la mejor calidad. - 14 parqueaderos de visitas. tawa te da más áreas recreativas que complementan su calidad de vida: -Coworking. -Gimnasio. -Piscina para niños. -Piscina recreativa. -Piscina de nado. -Área de yoga al aire libre. -Pista de piques. -Cancha cubierta de uso múltiples para niños. -Fire pit. -Juegos infantiles. -Área para mascotas. -Área de bbq y Teppanyaki. tawa te da más seguridad. - Ascensor. - Doble filtro de acceso. - Seguridad las 24 horas. - Cerramiento con cerca eléctrica perimetral. - Portero eléctrico. - 14 parqueaderos de visitas. 3 minutos del colegio Jose Engling, Epsilon Sport Zone y Pacho Salas. 9 minutos del Scala shopping, Colegio Alemán y de cualquier entrada a Quito. 10 minutos de U. S. F. Q, Colegio Menor y Paseo San Francisco. Trato personalizado durante todo el proceso de compra y luego del mismo, garantizamos la satisfacción de nuestros clientes. Tawa. tu lugar, tu bienestar, tu tranquilidad",./Plusvalia_raw_p1_060924_2243_files/logo_metroeje_1715290505758.jpg,Super destacado
USD 179.000,Av. República de El Salvador y Suiza,"República de El Salvador, Quito",,2 hab.,1 baño,73 m² tot.,2 estac.,N/A,N/A,"Entrega inmediata ¡Últimos departamentos de 2 dormitorios, en pisos altos y con vista incomparable! Suites y minisuites a g o t a d a s. Xoe un proyecto de Proaño | Proaño, concebido para que puedas trabajar, farrear y dormir, todo en un mismo lugar. Minisuites, suites y departamentos de 2 habitaciones, con espectaculares áreas comunales para que seas parte del primer Club Urbano Vertical de Quito. ¿qué es un club urbano? Es una comunidad conformada por gente que comparte intereses y aspiraciones. Un lugar para vivir, trabajar y divertirte, donde eres parte de un club exclusivo con espacios comunales y comerciales para todos sus miembros, como si fuera tu propia casa. Con excelente ubicación en pleno corazón del. Quito financiero. Ubicado en la Av. República de El Salvador y Suiza. Haz una cita: ¡Depar modelo abierto todos los días! Certificación edge: eco building. Edificio ecoeficiente. Certificación edge. Certificación municipio dmq. aéreas comunales xoe. subsuelo 1. • Bike parking. • Lavandería equipada. • Cuarto de reciclaje y basura. planta baja. • Bike parking. • Lobby a doble altura. o Elegante counter. o Área de espera con mobiliario y casilleros de correspondencia individual. • Coworking. o Bar-Cafetería. o Salas de Estar. o Sala Louge. o Mesas de trabajo. • Gimnasio equipado. Segundo piso. • Coworking. o Coworking exterior. o Sala de Reuniones (2) o Sala Lounge. o Mesas de trabajo. o Baños. terraza. Espacio de esparcimiento y relajación con terrazas ajardinadas. • Gourmet room: o Cocina equipada. o Barra. o Sistema de audio. o Cava de vinos. • Party room: o Bar. o Multimedia (Audio y Video) o Sala Lounge. o Chimenea. • Terraza Solarium: o 3 salas exteriores. o Jardines. o Butacas. o Iluminación. o Chimenea. • bbq. o Apergolado. o Barra-comedor. servicios comunales. • 2 ascensores de última tecnología. • Centro de casilleros privados de correspondencia. • Cisterna con sistema de presión constante de bombeo. • Sistema de optimización de luces. • Sistema de protección contra incendios. • Cámara de transformación. • Generador eléctrico (abastecimiento al 100% del edificio). • Sistema de intercomunicación privada. • Estructura sismo-resistente. • Extracción de aire mecánica en subsuelos y presurización en gradas de servicios. • Wifi abierto en áreas comunales. Seguridad. • Sistema de control de acceso. • cctv (circuito cerrado de tv) con conexión remota ip que controlara zonas de estacionamientos, hall de ingreso y áreas comunales. • Puestos de guardianía permanente. • Tranquilidad dentro de su hogar sin uso de calefón a gas ni artefactos de combustión que puedan generar explosiones o monóxido de carbono. • Conexión eléctrica 220 v en cada departamento.",./Plusvalia_raw_p1_060924_2243_files/logo_proano-proano-promotora-inmobiliaria_1689204444545.jpg,Super destacado
USD 194.000,Calle El Batán y Eloy Alfaro,"Centro Norte, Quito",USD 228 Alícuota,3 hab.,3 baños,106 a 111 m² tot.,2 estac.,N/A,N/A,"En el centro norte de la capital en la calle El Batan No3441 y Eloy Alfaro se encuentra ubicado el Edificio Estrella X, en el sector El Batan, es un sector residencial alejado del bullicio, Departamentos de Venta El Batán, con plena tranquilidad en un entorno muy agradable cerca de: - Megamaxi. - Supercines. - Quicentro Shoping. - La Carolina. descripción. - Departamentos de 1, 2 y 3 dormitorios. - 1 Garaje y 1 bodega por departamento. acabados de lujo. - Las puertas principales de ingreso a los departamentos con cerraduras digitales. - Mesones de cuarzo en la cocina y baños. - Grifería y sanitarios fv o Briggs. - Piso ingeniería o porcelanato. áreas Y servicios comunales. - Estructura tradicional, ¡Una sola inversión para toda la vida! - Sistema de agua caliente centralizado con bombas de calor. - Generador eléctrico automático para todo el edificio. - Sistema de cámaras de seguridad para todo el edificio. - Gimnasio equipado. - Área húmeda. - Jacuzzi. - Area Coworking. - Área bbq. - Area de Juegos para niños interna y externa. -Jardines y areas verdes reales. -Pista para caminar",./Plusvalia_raw_p1_060924_2243_files/logo_constructora-estrella-viteri_1637254146934.jpg,Super destacado
USD 430.000,Cumbaya,"Cumbayá, Quito",,3 hab.,3 baños,410 m² tot.,2 estac.,N/A,N/A,"La mejor vista de cumbayá! Departamento Penthouse de lujo con amplia terraza propia. Mayor información: Ver datos. * 240 m2 (piso completo) * 170 m2 de terraza propia. * Vista panorámica 360 grados. * 3 dormitorios con baños completos cada uno. * Sala de estar. * Cocina independiente con comedor de diario y balcón propio. * Sala y comedor. * 2 balcones. * Área de bbq. * 2 baño sociales. * 2 parqueaderos y 1 bodega. Sector seguro, tranquilo y exclusivo. Cercano a los puntos más importantes de Cumbayá Rodeado de naturaleza y tranquilidad, es tu oportunidad para adquirir un inmueble de lujo!",./Plusvalia_raw_p1_060924_2243_files/logo_dinmo-inmobiliaria_1569885872048.jpg,Super destacado
USD 235.000,Cumbayá Francisco de Orellana,"Cumbayá, Quito",,2 hab.,2 baños,240 m² tot.,1 estac.,N/A,N/A,"Venta departamento detrás del Paseo San Francisco Cumbayá. 7 años de antiguedad. 206 mts área de construcción cubierta. 35 mts área de construcción abierta. 240 mts totales. 2 dormitorios completos con terraza. 2 baños completos. 1 baño social. Sala, comedor, cocina estilo americano equipada con extractor de olores, cocina y horno a inducción, lavadora de platos. 2 amplias zonas de terrazas internas para bbq. 2 parqueaderos en línea. 2 bodegas. El Edificio cuenta con: Seguridad 24/7 con guardianía privada. Conserje. Circuito cerrado de cámaras de seguridad. Cerco eléctrico. Contáctame: Erika Tobar. 0 9 7 9 1 9 8 7 1 3",./Plusvalia_raw_p1_060924_2243_files/logo_re-max-asesoria-inmobiliaria_1724768437098.jpg,Super destacado
USD 279.000,Departamento Venta Atelier 3 Dormitorios,"Centro Norte, Quito",USD 85 Alícuota,3 hab.,2 baños,150 m² tot.,2 estac.,N/A,N/A,"Hermoso departamento atelier piso alto hermosa vista Ubicado en la 6 de Diciembre en el edificio Atelier3 habitaciones3 baños completosBaño socialSala comedorCocina tipo AmericanaBalcón frontal y lateralÁrea de maquinas2 parqueos1 bodegaEdificio cuenta: PiscinaÁrea húmeda (sauna, turco, hidro masajes) gymárea de juegos infantilesÁrea de juegos de adultosCineÁrea de máquinas (lavadora secadora) CoworkingCancha squashÁrea de bbqárea de eventosMiradorvalor de venta $279. 000",./Plusvalia_raw_p1_060924_2243_files/logo_luna-castellanos-marcia-del-rocio_1598500876322.jpg,Super destacado
USD 169.900,Mariano Paredes y Tadeo Benítez,"Ponceano, Quito",USD 20 Alícuota,3 hab.,1 baño,163 m² tot.,2 estac.,N/A,N/A,"Cómodo y lujoso departamento sector Ponceano alto espera por ti. Ubicación estratégica, cerca de todo. Aplica crédito hipotecario biess. Descripción: 125m2 Habitables. Balcón 7. 27m2. 2 Parqueaderos. Bodega 4. 13m2. Gran sala muy buen iluminada, cocina tipo americana encimera y extractor de olores. Comedor amplio. Baño social, y área de máquinas. 3 habitaciones bastante amplias, dormitorio máster con gran espacio en clóset y baño propio. Baño completo compartido. Acabados en excelente calidad, perfecto estado del inmueble. Excelentes amenidades, área de juegos, área de cine y bbq. Seguridad 24H.",./Plusvalia_raw_p1_060924_2243_files/logo_zion-inmobiliaria_3.jpg,Super destacado
USD 99.700,nuño de valderrama y mariana de jesus,"Mariana de Jesús, Quito",USD 137 Alícuota,3 hab.,2 baños,133 m² tot.,1 estac.,N/A,N/A,"¿Sueñas con un departamento amplio, luminoso y con una vista impresionante? ¡No busques más! Este hermoso departamento de 117 m2 habitables en la última etapa del Conjunto La Granja te ofrece todo lo que necesitas y más. ¡Vive en este departamento con vista espectacular en la Urbanización La Granja! Ubicado a solo 2 cuadras del Hospital Metropolitano, este departamento te brinda la combinación perfecta de tranquilidad y cercanía a todos los servicios. Disfruta de la naturaleza en los parques cercanos, mientras tienes fácil acceso a centros comerciales, iglesia, clínicas, hospitales, colegios y transporte público. Caracteristicas: • Luminosidad excepcional: Gracias a su ubicación en el 4to piso en la esquina del edificio, con orientación nororiente y noroccidente, el sol ilumina el departamento durante todo el día, llenándolo de calidez y alegría. • Vista panorámica: Disfruta de una vista espectacular desde la sala comedor, dormitorios y áreas comunes, ideal para relajarse y contemplar la belleza del entorno. • Amplitud y distribución funcional: El departamento está distribuido de manera eficiente, aprovechando al máximo cada espacio. Distribución: • Hall de entrada: Un espacio acogedor que te da la bienvenida a tu hogar. • Espaciosa sala comedor: Un lugar ideal para compartir momentos en familia o con amigos, gracias a sus grandes ventanales y chimenea. • Cocina semi abierta: Moderna y funcional, con muebles altos y bajos, mesones de estilo americano y mesón desayunador, perfecta para preparar tus comidas favoritas. • Área de máquinas: Equipada con lavantín y calefón para el agua caliente, para mayor comodidad. • Área para gym u otro uso: Un espacio flexible que puedes utilizar como gimnasio, estudio, sala de juegos o según tus necesidades. • Dormitorio máster: Amplio y luminoso, con closet y baño privado renovado, ideal para tu descanso y privacidad. • Dos dormitorios adicionales: Ambos con closet y ventana, brindando comodidad para toda la familia. • Un baño completo renovado compartido: Para mayor comodidad de todos los habitantes. • 1 parqueo: Para que tu vehículo esté siempre seguro. • 1 bodega: Para guardar tus pertenencias adicionales. Este departamento es ideal para: • Familias que buscan un espacio amplio, luminoso y cómodo para vivir. • Parejas que quieren disfrutar de un ambiente tranquilo y cercano a todo. • Personas que aprecian la vista panorámica y la luz natural. • Profesionales que buscan un lugar accesible para trabajar y disfrutar del tiempo libre. No pierdas la oportunidad de vivir en este departamento único en La Granja. ¡Contáctanos hoy mismo para agendar una visita! #DepartamentoEnVenta #LaGranja #VistaEspectacular #AmplioLuminoso #CercaDeTodo #UbicaciónPerfecta #IdealParaFamilias",./Plusvalia_raw_p1_060924_2243_files/logo_remax-capital_1713196405746.jpg,Super destacado
USD 105.000,Av. Eloy Alfaro,"La Carolina, Quito",USD 115 Alícuota,2 hab.,2 baños,105 m² tot.,1 estac.,N/A,N/A,"Disfruta de un hogar en este encantador departamento con terraza, en el sector del estadio Atahualpa - La Carolina, con las siguientes características: Descripción de áreas: Área cubierta 89. 60 m². Un parqueadero cubierto. Descripción de espacios: - Área social muy iluminada conectada con la terraza. - Cocina independiente con muebles aéreos y bajos. - 2 dormitorios, master con su propio baño completo. - Un baño completo para la segunda habitación y social. - Área de máquinas. El departamento se encuentra en planta baja, cuenta con medidor propio de luz y agua. (15 años de antigüedad) La terraza no se encuentra en escrituras, pero es de uso exclusivo del departamento. El edificio cuenta con guardianía remota 24/7, conserje 8am - 7pm, salón comunal, terraza con área bbq y parqueaderos de visita. Precio de venta: $105. 000. alícuota: $99",./Plusvalia_raw_p1_060924_2243_files/logo_eduardo-guerrero_1595608448594.jpg,Super destacado
USD 339.000,CITE CENTER,"Cumbayá, Quito",USD 70 Alícuota,2 hab.,2 baños,300 m² tot.,2 estac.,N/A,N/A,"Departamento de 260 m2. El departamento cuenta con: * Amplia cocina con comedor de Diario. * Cuarto de lavado. * Baño de servicio. * Baño social. * Sala. * Comedor social. * Sala de Estar amplia. * Habitación Master con amplio walking closet, baño y vista al valle. * Dos habitaciones con walking closet, baño privado y balcón, cada una. * El edificio cuenta con piscina sin fin, área de bbq y Juegos y amplia zona social. * 2 parqueaderos paralelos para autos grandes. * 1 Bodega",./Plusvalia_raw_p1_060924_2243_files/154818.jpg,Super destacado
USD 199.987,INTERVALLES,"Cumbayá, Quito",,2 hab.,2 baños,167 m² tot.,1 estac.,N/A,N/A,"Hermoso departamento de venta en cumbayá por el scala shopping! ! Jardín! ! Entrega feb de 2025. Nexos Realty vende hermoso departamento de dos habitaciones en Syrah Palms cumbayá! ! Con jardín! ! Otros departamentos disponibles! ! Syrah Palms tiene una ubicación estratégica y privilegiada, entre el Scala Shopping y el Ventura Mall! En el corazón del valle, Syrah Palms está en una urbanización cerrada, con un entorno natural y linda vista hacia el Ilaló.  2 dormitorios y 2. 5 Baños.  Sala, comedor, cocina.  Sala exterior y jardín.  2 parqueaderos.  Área de Lavado.  Bodega. Cerca de todo:  A 5 minutos de la Plaza de Cumbayá  A 2 minutos del Hospital de los Valles.  A 2 minutos del Scala Shopping.  A 2 minutos de la Ruta Viva. El proyecto consiste de 30 departamentos de 1, 2, y 3 habitaciones. Syrah Palms brinda exclusividad e independencia en todas las unidades, espectaculares áreas comunales y paisajismo con lindas áreas verdes.  Materiales de primera calidad.  Parqueadero para visitas.  Cerramiento perimetral.  Servicios soterrados.  Jardines comunales.  Control de accesos.  Cámaras cctv.  Pet friendly.  Guardianía. edeconsa Construcciones: Empresa constructora con más de 27 años de experiencia y con proyectos en todo el país. Comprometida con la satisfacción de sus clientes. Entrega proyectos de la más alta calidad. Para conocer más comunícate con Nexos Realty!",./Plusvalia_raw_p1_060924_2243_files/logo_nexos-realty_1718643766032.jpg,Super destacado
USD 95.000,Vendo Suite en Proyecto con la Mejor Ubicación Estratégica en el Sector de Cumbayá,"Cumbayá, Quito",USD 1 Alícuota,1 hab.,2 baños,61 m² tot.,N/A,N/A,N/A,"Hermosa suite con jardín independiente en proyecto61, 5 m2Jardín de 13m2usd 95. 000Excelente ubicación junto a importantes vías de fácil y rápido acceso a farmacias, hospitales, colegios y bancos. ¡Encuentra el lugar de tus sueños! Amenities: Parqueaderos de visitasBodegasTerraza PanorámicaSalón comunalÁrea de MascotasGimnasio equipadoCoworkingZona bbqfirePitPetWashEntrega diciembre 2024¡Sueña, siente, vive tu espacio!",./Plusvalia_raw_p1_060924_2243_files/logo_grupo-3-inversiones_6.jpg,Super destacado
USD 269.999,CATALINA ALDAS Y PORTUGAL,"Centro de Quito, Quito",,4 hab.,2 baños,155 m² tot.,N/A,N/A,N/A,"Departamento 4 dormitorios semi amoblado. *cuenta con cocina, horno, refrigeradora, lavadora secadora. * 143. 40 metros de construcción. *edificio la recoleta. *dos baños Y medio. *dos estacionamientos. * dos bodegas. *edificio con excelentes areas comunales. *piscina, gym, sala de cine, sala de bolos. *valor de renta: $1. 000 mas alicuota $227, 62. *valor de venta: $269. 999. *mayores informes: Ver datos. lorena santoliva. inmocumbres",./Plusvalia_raw_p1_060924_2243_files/logo_grupo-brokers-inmobiliarios-ecuador_1662652170999.jpg,Super destacado
