Precio,Ubicación,Ciudad,Expensas,Habitaciones,Baños,Área,Estacionamientos,Precio/m²,Fecha de Publicación,Descripción,Logo Agencia,Destacado
USD 350.000,Bosmediano,"Bellavista, Quito",USD 180 Alícuota,3 hab.,3 baños,250 m² tot.,3 estac.,N/A,N/A,"Amplio, luminoso y moderno departamentos con vista espectacular a la ciudad de Quito. El edificio cuenta con seguridad 24/7. El edificio cuenta con piscina, terraza y área bbq comunales. 205 m2 área cubierta. . 45 m2 en dos Terrazas. 3 dormitorios. 3 baños. 1 baño social. sala, comedor y cocina integrados. terraza. 2 estacionamiento. 1 bodega. Area comunal. Piscina. Terraza. Area bbq. Agente Inmobiliario. María Amparo Proaño",./Plusvalia_raw_p18_060924_2243_files/logo_inmobusiness-s.a._1694815287277.jpg,Super destacado
USD 159.000,Departamento en Venta en el Sector de Campo Alegre Cerca de la Udla,"Monteserrín, Quito",USD 164 Alícuota,2 hab.,2 baños,174 m² tot.,2 estac.,N/A,N/A,"Departamento en venta en Conjunto Habitacional ubicado en el Oriente de Quito, sector Monteserrin, zona de alta plusvalía lo que lo convierte en una muy buena inversión. Con una vista impresionante del Valle de Cumbayá, ademas tiene varios colegio cercanos, la udla y fácil acceso al transporte público. Área total: 174m²-2 habitaciones. -Dormitorio extra o estudio fuera del departamento. -Baño social completo, comparte con un dormitorio. -Espacio para lavadora-secadora o torre. -Triturador de basura y lavadora de platos. -Plancha, horno y extractor de olores. -Balcón tipo terraza de 17m. -2 parqueaderos. -Bodega. Urbanización cuenta con: -2 Canchas de Squah. -Gimnasio. -Piscina cubierta y temperada. -Sauna y turco. -Área bbq. -Áreas verdes y de juegos infantiles. -Generador eléctrico. -Sistema de control de incendios. -Parqueadero de visitas. Precio de venta $159. 000 Estamos felices de atenderte, somos Hauser Ecuador!! Pregúntanos por nuestros recorridos online o más opciones inmobiliarias para ti.",./Plusvalia_raw_p18_060924_2243_files/logo_hauser-ecuador_1675785942321.jpg,Super destacado
USD 199.000,Edificio St Marcus Cumbaya,"Cumbayá, Quito",USD 140 Alícuota,2 hab.,2 baños,120 m² tot.,2 estac.,N/A,N/A,"Vendo departamento Cumbayá nuevo por estrenar. Hermosa vista desde todos los rincones! Edificio con Piscina, Gym, Terraza bbq y Seguridad 24 horas. * Área: 120 m2. * 2 Dormitorios amplios con baños completos cada uno. * Sala de estar / Estudio. * Sala y comedor con vista. * Cocina tipo americano equipada con plancha, horno y extractor. * Baño social y área de máquinas. * Parqueaderos: 2. * Bodegas: 1. Seguridad 24 horas, 2 ascensores (acceso con tarjetas) Facilidad de accesos, ubicado en un sector super residencial y tranquilo. A 3 minutos del Scala, a 5 minutos del Paseo San Francisco.",./Plusvalia_raw_p18_060924_2243_files/logo_dinmo-inmobiliaria_1569885872048.jpg,Super destacado
USD 80.000,De los Lirios y Julio Arellano 45 Piso 2 Dpto 3 (170124),"Monteserrín, Quito",,3 hab.,2 baños,105 m² tot.,1 estac.,N/A,N/A,"Se venden 4 departamentos en el sector de Monteserrín, ubicados cerca de la Universidad de las Américas y la Academia Cotopaxi, ofrece buen acceso a vías principales para facilitar la movilidad. El área cuenta con servicios esenciales, haciendo de este departamento una buena opción. Contacto: Ver datos. Andrea Noboa",./Plusvalia_raw_p18_060924_2243_files/logo_re-max-asesoria-inmobiliaria_1724768437098.jpg,Super destacado
USD 120.900,Cumbaya,"Cumbayá, Quito",,2 hab.,2 baños,77 m² tot.,1 estac.,N/A,N/A,"77. 3 m2usd 120. 900Excelente ubicación junto a importantes vías de fácil y rápido acceso a hospitales, centros comerciales, a la usfq, bancos y aeropuertoUbicado a 3 minutos del C. C. Scala Shopping2 parqueaderos privadosParqueaderos de visitasBodegasTerraza PanorámicaEspectaculares AmenitiesÁrea de MascotasGimnasio equipadoLaundry comunalBusiness centerSalón comunalSenderos naturales con espectaculares áreas verdesEntrega Diciembre 2024",./Plusvalia_raw_p18_060924_2243_files/logo_grupo-3-inversiones_6.jpg,Super destacado
USD 50.000,Gral José María Guerrero,"Cotocollao, Quito",USD 38 Alícuota,3 hab.,1 baño,74 m² tot.,1 estac.,N/A,N/A,"Departamento de Venta en excelente ubicación. Ubicado en el Conjunto Habitacional La Recoleta. Av Gral. José María Guerrero y Manta. Cerca a la Universidad Indoamérica. 74. 1 m2 de Construcción. 3 habitaciones. 1 Baño Completo. Sala. Cocina. Comedor. Área de Lavado y Tendedero. 1 parqueadero. Parqueadero de Visitas. Áreas Comunales. Canchas deportivas. Juegos Infantiles. Espacios Verdes. Ubicación estratégica, cerca de universidad Indoamérica, Colegio William Thompson, y varios colegios más por el sector. Cerca de Instituciones Financieras, Centros Comerciales y lugares muy comerciales como Cotocollao. Fácil Acceso a líneas de Buses y rutas de acceso de automóviles. Cerca del Supermaxi de San Carlos, Gran Akí de Cotocollao, tuti, tía. Etc.",./Plusvalia_raw_p18_060924_2243_files/logo_re-max-impacta-inmobiliaria_1706106145193.jpg,Super destacado
USD 145.213,AV EL CORAZON Y SALCEDO,"Sur de Quito, Quito",USD 1 Alícuota,3 hab.,2 baños,151 m² tot.,2 estac.,N/A,N/A,"Consta de: Sala. Comedor. Bar. Cocina con muebles altos y bajos. Área de maquinas. 1 Baño social. Dormitorio master con walking closet y baño privado con hidromasaje. 2 Dormitorios. 1 baño completos. 1 parqueadero. 1 bodega (opcional) Áreas comunales: Servicio de garita y vigilancia. Cámaras de video vigilancia. Ascensor. Área bbq. Áreas verdes. Gimnasio. Salón de eventos. Área Pet spa. Cerca de farmacias, tiendas, restaurantes, parada de buses metro, ecovia, etc",./Plusvalia_raw_p18_060924_2243_files/logo_zion-inmobiliaria_3.jpg,Super destacado
USD 228.000,Quito tenis,"Quito Tenis, Quito",USD 226 Alícuota,3 hab.,3 baños,258 m² tot.,2 estac.,N/A,N/A,"258 m2 de construcción. 3 salas. Chimenea en sala principal. Comedor amplio para mesa de hasta 12 sillas. Cocina remodelada con mesones de quarzo. Area de servicio completa. Lavandería y despensa. Tuberia de cobre en todo el departamento. Sala de estar que puede ser estudio. 1 dormitorio master con walk in closet y baño completo. Dos dormitorios con baño completo. 2 garages, ingreso desde parqueadero con tarjeta magnetica. 1 bodega. Guardiania 24/7. Ascensor, departamento en segundo piso. Asesora Inmobiliaria. vanessa cordovez. Inmobusiness",./Plusvalia_raw_p18_060924_2243_files/logo_inmobusiness-s.a._1694815287277.jpg,Super destacado
USD 249.500,CORUÑA,"Centro Norte, Quito",USD 155 Alícuota,3 hab.,2 baños,147 m² tot.,2 estac.,N/A,N/A,"Departamento Duplex de venta con Balcón en La Coruña. 140 m2 Área de construcción tota incluido el balcón: 147. 54 m2. Área de balcón: 5m2. 3 Dormitorios, Master con walk-in closet ( Dormitorio master con patio) 2 Baños completos. 1 Baño social. Sala de estar o televisión. Cocina americana. Sala. Comedor. 2 estacionamientos. Servicios generales. Seguridad 24 horas. Sala comunal. Jardines. Ascensores. Inmobusiness te invita a conocer este hermoso y amplio duplex en el piso 5, cuenta con acabados de primera de la mejor calidad y tiene un balcón. El tamaño y distribución del departamento ofrece ambientes acogedores, claros y muy espaciosos. Su ubicación es privilegiada está a pocos minutos del centro financiero y centros comerciales de la zona, cuenta con fácil acceso a a vías principales y transporte público. María Augusta Mora Coloma. Asesor Inmobiliario. inmobusiness S. A.",./Plusvalia_raw_p18_060924_2243_files/logo_inmobusiness-s.a._1694815287277.jpg,Super destacado
USD 169.900,Mariano Paredes y Tadeo Benítez,"Ponceano, Quito",,3 hab.,2 baños,163 m² tot.,1 estac.,N/A,N/A,"Cómodo y lujoso departamento sector Ponceano alto espera por ti. Ubicación estratégica, cerca de todo. Aplica crédito hipotecario biess. Descripción: 125m2 Habitables. Balcón 7. 27m2. 2 Parqueaderos. Bodega 4. 13m2. Gran sala muy buen iluminada, cocina tipo americana encimera y extractor de olores. Comedor amplio. Baño social, y área de máquinas. 3 habitaciones bastante amplias, dormitorio máster con gran espacio en clóset y baño propio. Baño completo compartido. Acabados en excelente calidad, perfecto estado del inmueble. Excelentes amenidades, área de juegos, área de cine y bbq. Seguridad 24H.",./Plusvalia_raw_p18_060924_2243_files/logo_zion-inmobiliaria_3.jpg,Super destacado
USD 78.000,Jipijapa,"Jipijapa, Quito",USD 50 Alícuota,3 hab.,1 baño,68 m² tot.,2 estac.,N/A,N/A,"68. 55 m² área de construcción. 3 Dormitorios. 1 Baño Completo. 1 Baño Social. Cocina cerrada. Sala / Comedor. Lavanderia. 1 Parqueadero cubierto. 1 Bodega. 1 Secadero. Juegos para niños. Salón Comunal. Canchas. Departamento de 3 habitaciones con excelente ubicación cerca a la Estación de Buses de la Rio Coca. El conjunto tiene guardiania 24/7. Edificio Con Ascensor está ubicado en el 2do piso. Esta propiedad espera por ti, te invito a conocerla! Asesor Inmobiliario. Paulina López. inmobusiness S. A.",./Plusvalia_raw_p18_060924_2243_files/logo_inmobusiness-s.a._1694815287277.jpg,Super destacado
USD 149.000,Urbanización el Condado,"El Condado, Quito",,3 hab.,3 baños,207 m² tot.,2 estac.,N/A,N/A,"Departamento en venta, Sector Urbanización El Condado, etapa 2. Área: 206. 50 m2. Cuenta con 3 cómodos dormitorios, 3 baños completos, Área de studio, sala de estar, Amplia cocina, cerrada, cuenta con alacena, muebles altos y bajos,. Terraza comunal acceso directo solo para el departamento. Piso 1 (pb) 2 garajes paralelos, 1 bodega. Año de construcción 2000. Precio de venta $ 149. 000. Visitas con cita previa. Multigestion: María del Pilar Corella. Ver datos. Adrián Rueda. Ver datos",./Plusvalia_raw_p18_060924_2243_files/logo_grupo-inmobiliario-renta-venta-compra_1685034999757.jpg,Super destacado
USD 128.000,MIRAVALLE,"Miravalle, Quito",USD 68 Alícuota,2 hab.,1 baño,113 m² tot.,1 estac.,N/A,N/A,"Venta de departamento sector miravalle. #vistagrande #ranchosanfrancisco. #urbanizacionsanisidrodecumbaya. Área habitable 78m. Balcón 13m. Áreas de parqueaderos 22m. Sala, comedor y cocina integradas al área social. 2 Dormitorios. 1 Baño completo. 1 Baño social. 2 Parqueaderos. Área de Lavadora y secadora. Gas Centralizado. Tiene Ascensor. areas comunales. Salón Comunal. Área de bbq. Guardianía 24 horas a través de monitoreo centralizado. Pago de Gas, agua y luz por cuenta del cliente. Departamento ubicado en un edificio de 4 pisos, el inmueble está en el 1 piso con un hermoso Balcón, queda a 1 minuto de farmacias, cafetería, gasolinera, panadería, lugares de esparcimiento, a 3 minutos del Rancho San Francisco. A 10m minutos de Quito y de Cumabayá Venta $Ver datos. Alícuota $68. asesor: Gabriela Zambrano. Asesor Inmobiliario. inmobusiness S. A.",./Plusvalia_raw_p18_060924_2243_files/logo_inmobusiness-s.a._1694815287277.jpg,Super destacado
USD 83.000,Gaspar de Villarroel y 6 de Diciembre,"La Carolina, Quito",USD 70 Alícuota,3 hab.,2 baños,70 m² tot.,2 estac.,N/A,N/A,"De oportunidad vendo departamento flamante. Ubicado en el Conj Parque Real, cerca de la udla y Quicentro. * 70 m2. * 4to piso. * Vista hacia los jardines interiores (mucha tranquilidad, sin bulla) * 3 dormitorios (master con walk in closset y baño completo) * Sala y comedor. * Cocina con área de máquinas. * 2 baños completos. * 1 parqueadero. Areas comunales: * Area de bbq. * Gimnasio. * Juegos infantiles. * Salón Comunal. * Guardiania 24 horas. * Parqueadero de visitas.",./Plusvalia_raw_p18_060924_2243_files/logo_dinmo-inmobiliaria_1569885872048.jpg,Super destacado
USD 209.900,razon y comercio,"La Carolina, Quito",USD 1 Alícuota,3 hab.,2 baños,120 m² tot.,1 estac.,N/A,N/A,"Edificio nuevo ubicado en el Sector Quicentro Shopping; lugar residencial de alta plusvalía a cinco minutos del parque la Carolina. Características del Edificio: - Tecnología Edge; te permite ahorrar recursos de luz y agua. - Torre de 10 pisos y 3 Subsuelos. - Elegantes y Funcionales Departamentos desde 1, 2 y 3 dormitorios. - Ascensor de Alta Velocidad. - Sala de reuniones. - Gimnasio Equipado. - Hidromasaje. - Baño sauna y Baño turco. - bbq con pérgola amplia zona verde natural. - Accesos Automatizados. - Generador Eléctrico de emergencia para todo el edificio. - Vigilancia 24 horas. Características del departamento 3 dormitorios: - Área cubierta 112M2. - Dos balcones cada uno de 4 M2. - Tres dormitorios. - Dos baños completos. - Baño social. - Sala/ Comedor. - Sala de Estar. - Elegante cocina. - Cuarto de máquinas de lavar. - Ventanales de piso a techo. - Acabados de lujo - Exclusivo departamento con una impresionante vista a la ciudad. - Bodega. - Un Parqueadero. - Precio $209. 900",./Plusvalia_raw_p18_060924_2243_files/logo_inmoimpakto-inmobiliaria_1606316253342.jpg,Super destacado
USD 95.000,Oe31-N67-148,"Ponceano, Quito",USD 55 Alícuota,3 hab.,2 baños,138 m² tot.,1 estac.,N/A,N/A,"Vendo hermoso departamento ubicado en la exclusiva zona residencial de Ponceano, al norte de la ciudad. Este acogedor hogar de 138 metros cuadrados, cuenta con: • 2 amplios dormitorios que comparten un baño completo. • Habitación máster con baño completo. • Estudio ideal para trabajar desde casa. • Cocina con muebles altos y bajos, perfectamente equipada. • Área de lavado y secado para ropa. • Patio posterior ideal para momentos de relajación. • 2 parqueaderos para tu comodidad. • Bodega para almacenamiento extra. • Área comunal en la terraza para eventos y reuniones. • Ubicación privilegiada cerca de farmacias, supermercados, Centro Comercial Condado Shopping, locales comerciales y restaurantes. ¡No pierdas esta oportunidad! Contáctanos para más información y para agendar una visita.",./Plusvalia_raw_p18_060924_2243_files/logo_inmoimpakto-inmobiliaria_1606316253342.jpg,Super destacado
USD 87.000,Prensa y fernando davalos,"California, Quito",USD 15 Alícuota,3 hab.,1 baño,122 m² tot.,1 estac.,N/A,N/A,"Departamento de Venta Quito. 110 m2 Construcción. La prensa cerca al antiguo aeropuerto mariscal sucre. En conjunto 3r piso Sin ascensor. 3 dormitorios. 1. 5 baños. Sala. Comedor. Cocina. Área de lavandería. Bodega. 1 parqueadero. Parqueadero de visitas. Cancha, Juegos infantiles. Ver datos",./Plusvalia_raw_p18_060924_2243_files/logo_asesores-inmobiliarios_1717436568806.jpg,Super destacado
USD 155.000,REPUBLICA DEL SALVADOR,"República de El Salvador, Quito",USD 104 Alícuota,3 hab.,2 baños,104 m² tot.,2 estac.,N/A,N/A,"En el corazón del centro norte de la ciudad se encuentra este amplio departamento en piso alto, con buena entrada del luz en las habitaciones y ubicado cerca de centros comerciales, farmacias, supermercados, instituciones financieras, con acceso a vías principales y transporte público. 104 m2 Área de construcción. 3 Dormitorios. 2 Baños completos. Sala comedor. Cocina cerrada. Área de máquinas. 1 Estacionamientos. 1 Bodega. Edificio cuenta con gimnasio y terraza con área de bbq, ascensor con tarjetas de aproximación y guardia24-7. Te invito a conocer esta propiedad, Iván Vinces.",./Plusvalia_raw_p18_060924_2243_files/logo_inmobusiness-s.a._1694815287277.jpg,Super destacado
USD 98.000,MARIANA DE JESUS E INGLATERRA,"Mariana de Jesús, Quito",USD 58 Alícuota,2 hab.,2 baños,89 m² tot.,1 estac.,N/A,N/A,"¡vive con comodidad Y seguridad en el centro norte! En plena Mariana de Jesús e Inglaterra se encuentra este maravilloso apartamento que cuenta con todas las comodidades de la vida moderna. Disfruta de privacidad, comodidad y tranquilidad en este moderno lugar. Ubicacion. A 3 minutos del Mall el Jardín y Parque La Carolina, 7 minutos de La Mariscal, a pocos pasos de la Av. 10 de agosto. Cercano a tiendas, Centros Comerciales, hoteles, servicios públicos, oficinas y fácil acceso a trasporte público. Sobre la propiedad. Sector Mariana de Jesús | Edificio Moderno |80 m2 de construcción| Piso 13 |Linda vista de la ciudad|Excelente iluminación natural Excelente iluminación natural| Sala - Comedor en un solo ambiente|Cocina abierta equipada con encimera, extractor y horno |2 Habitaciones| Master con baño|2 Baños Completos|Área de lavado|1 Parqueadero |Bodega| amenities. Terraza | bbq | Salón Comunal| servicios. Edificio con vigilancia permanente. valor $ 98. 000. Alícuota us$ 58. planifica tu visita. cbr. wendy lopez. 0. 9. 8. 0. 8. 6. 9. 0. 9. 1. juan carlos rueda. 0. 9. 5. 8. 6. 9. 4. 8. 0. 7",./Plusvalia_raw_p18_060924_2243_files/logo_deluxe-properties_1676655432470.jpg,Super destacado
USD 289.900,Gonzalez Suarez,"González Suárez, Quito",USD 407 Alícuota,3 hab.,3 baños,300 m² tot.,2 estac.,N/A,N/A,"Departamento de venta en quito sector gonzalez suarez. 300 m2 de construcción. Sala con vista al valle. Comedor con salida al Balcón. Cocina independiente. Baño social. Dormitorio Master con walk in closet y baño con tina y ducha. 2 Dormitorios con baño y closet cada uno. Sala familiar o de tv. Cuarto de Lavandería. Cuarto de servicio con baño. 2 Estacionamientos lineales. 1 Bodega. Guardianía presencial las 24 horas. 1 Ascensor directo a la sala del departamento. 1 Ascensor para servicio y carga. Departamento se vende con o sin muebles. Departamento ubicado sobre la avenida González Suarez, en el primer piso de edificio de 10 pisos donde cada departamento ocupa la totalidad del piso lo que permite que tenga vista hacia el valle de Tumbaco y hacia la González Suarez. El departamento ha sido remodelado para darle su toque de modernidad en sus ambientes. El ascensor te lleva directo al area social del departamento y hay otro solo para servicio o carga. Yamile Dager. Asesor Inmobiliario. Inmobusiness sa",./Plusvalia_raw_p18_060924_2243_files/logo_inmobusiness-s.a._1694815287277.jpg,Super destacado
USD 194.039,El Batán,"El Batán, Quito",,3 hab.,2 baños,106 m² tot.,2 estac.,N/A,N/A,"Departamento de venta sector el batan. 104 m2 habitables. 1, 92 m2 de balcón. 106 m2 Total. 3 habitaciones. 2 baños completos. 1 baño social. Cocina tipo americana, incluye cocina, extrator de olores. Área de lavandería. 1 parqueadero. 1 bodega. Características del edificio. Guardianía 24 horas. Planta de energía eléctrica. Dos ascensores. Business Center. Sala Comunal con juegos de mesa y tv. Áreas húmedas con jacuzi, sauna y turco. Cancha de uso múltiple. Gimnasio. El departamento se encuentra en el 8 vo piso, gracias a los ventanales es muy claro y caliente, el servicio de agua caliente es centralizado, tiene una excelente ubicación a minutos del Megamaxi, de instituciones financieras y transporte público. Paulina López. Asesora Inmobiliaria",./Plusvalia_raw_p18_060924_2243_files/logo_inmobusiness-s.a._1694815287277.jpg,Super destacado
USD 138.000,AV. Republica DEL Salvador,"La Carolina, Quito",USD 1 Alícuota,2 hab.,1 baño,129 m² tot.,1 estac.,N/A,N/A,"Sector república del salvador en venta dpto 02D con estudio 98 M2#fácil acceso a transporte público, cerca a supermaxi,  paranderias, super cines, notarias, bancos, hoteles, cerca al ecovia. -98, 05 m2-2 Dormitorios mas estudio-2. 5 baños-Amplia Sala comedor-Cocina indendiente totalmente remodelada-2 parqueaderos independientes-1 bodega-Área de lavandería-Valor $138 mil negociables ""A un click de tu nuevo hogar""",./Plusvalia_raw_p18_060924_2243_files/logo_miroeslada-vallejo-noboa_1581971666237.jpg,Super destacado
USD 390.000,SANTA BARBARA,"Cumbayá, Quito",USD 280 Alícuota,3 hab.,3 baños,240 m² tot.,1 estac.,N/A,N/A,"Nexos Realty vende lindo departamento en Cumbayá, frente a la cervecería y a pocos pasos de El Chaquiñán!!  Excelente ubicación y vista!!  Son 240 m2 de construcción.  20 m2 de terraza.  Tres (3) dormitorios, cada uno con su baño.  Baño social.  Closet de ropa blanca.  Dos (2) parqueaderos paralelos.  Bodega.  Guardianía 24/7.  Áreas comunales: piscina, gimnasio, sala de cine, sala comunal, juegos para niños.  6 años de construcción.  Pisos de mármol travertino.  Cocina independiente con campana extractora.  Área de máquinas.  Cuarto y baño de servicio.  Mesones de granito.  Vista privilegiada.  Sala de tv.  Gran dormitorio máster con vestidor, baño con doble lavabo.  Calentamiento de agua centralizado con bombas de calor.  Edificio con generador eléctrico.  Cisterna.  Cortinas en todo el departamento. El Conjunto Santa Bárbara tiene 54 departamentos con: • Ubicación privilegiada en Cumbayá • Un proyecto diseñado con muchas facilidades e innovaciones. • Espectacular vista al Valle de Tumbaco. • Junto al Chaquiñán. • Arquitectura moderna y acogedora a la vez. • Más de 3000 m2 de áreas verdes. • Acabados de lujo. • Sala de cine – Juegos Infantiles. • Hidromasaje. • Piscina. • Gimnasio. • Estacionamientos Subterráneos. • Generador eléctrico para todos los departamentos. • Seguridad con Circuito Cerrado. • Ascensores",./Plusvalia_raw_p18_060924_2243_files/logo_nexos-realty_1718643766032.jpg,Super destacado
USD 92.000,Av. San Luis,"Los Chillos, Quito",USD 100 Alícuota,2 hab.,2 baños,117 m² tot.,2 estac.,N/A,N/A,"Cc Inmobiliaria vende departamento en el valle de Los Chillos, San Rafael, a 100 metros del San Luis Shopping. Ascensor. Valor $92. 000, negociables. Cuenta con: - Sala. - Comedor. - Cocina abierta con desayunador, plancha de inducción y horno. - Dos dormitorios con baño cada uno. - Áreas de máquinas. - Balcón. - Baño social. - Un parqueadero. Contactos: Cecibel Ver datos.",./Plusvalia_raw_p18_060924_2243_files/logo_grupo-inmobiliario-renta-venta-compra_1685034999757.jpg,Super destacado
USD 46.990,Carlos Mantilla,"Calderón, Quito",,2 hab.,1 baño,77 m² tot.,1 estac.,N/A,N/A,"Hermosos Departamentos ubicados en el norte de Quito, San José de Morán. no continúes pagando arriendo. mejor paga por tu propio departamento. 62. 5 m2 Habitables. 2 habitaciones. 1 baño completo. Sala-cocina, muebles altos y bajos con mesones en granito. Acabados excelentes, gypsum. 1 parqueadero. El conjunto cuenta con áreas sociales únicas. Gimnasio equipado. Yacuzzi. Dos espacios de bbq. Área de Cine. Esta es la oportunidad que buscabas. Agenda tu visita ahora mismo!",./Plusvalia_raw_p18_060924_2243_files/logo_zion-inmobiliaria_3.jpg,Super destacado
USD 135.000,Unidad Nacional,"Quito Tenis, Quito",,2 hab.,2 baños,268 m² tot.,2 estac.,N/A,N/A,"182. 61 m2 Área de construcción cubierta. 85. 73 m2 Área de construcción abierta. Dormitorio Master con walk in closet y baño. 1 Dormitorio con closet y baño. Sala / Comedor. Cocina americana. Estudio o sala familiar. Baño social. Balcón. 2 Estacionamientos paralelos cubiertos. 2 Bodegas. Terraza. Edificio no tiene ascensor. Servicios Comunales. Puerta vehicular eléctrica de acceso a la cuchara. Moderno departamento dúplex de con amplios ventanales. Edificio de 3 departamentos dúplex. Departamento en segunda planta, cuenta con terraza. Excelente ubicación con acceso a vías principales, cerca de centros comerciales, de salud y educativos, entre otros. asesor inmobiliario. Yamile Dager. Inmobusiness s. a.",./Plusvalia_raw_p18_060924_2243_files/logo_inmobusiness-s.a._1694815287277.jpg,Super destacado
USD 88.000,ELOY ALFARO Y ANDRADE MARAIN,"La Carolina, Quito",USD 127 Alícuota,2 hab.,1 baño,127 m² tot.,2 estac.,N/A,N/A,"Departamento de venta - Sector Parque La Carolina. verdadera oportunidad, bajo de precio! Precio solo de contado. se acepta financiamiento bancario. departamento en edificio residencial 2do piso. A menos de una cuadra del parque carolina por la eloy alfaro 50 mts. A 100 mts de la parada del metro. A 200 mts del mall el jardin. luz natural. hay 2 departamentos por piso. departamento muy tranquilo para vivir Y descansar! Metros de construcción 109 M2 habitables. 2 habitaciones. un baño completo. un medio baño. sala comedor. cocina. area de maquinas. estudio con muebles empotrados. 1 bodega comoda de 3, 60 m2. 1 parqueadero amplio de15 m2. departamento en edificio con conserje Y guardiania. edificio con ascensor. terraza comunal. departamento libre de hipoteca. se acepta financiamiento bancario. ubicacion en el mapa es exacta",./Plusvalia_raw_p18_060924_2243_files/154818.jpg,Super destacado
USD 149.500,GRANDA CENTENO,"Granda Centeno, Quito",USD 200 Alícuota,3 hab.,2 baños,123 m² tot.,2 estac.,N/A,N/A,"Venta departamento sector granda centeno. 123m Construcción habitable. Sala. Balcón. Comedor. Cocina con muebles altos y bajos. Área de máquinas. 3 Dormitorios. 2 Baños Completos. Baño social independiente. 2 Parqueaderos. 1 Bodega. Sistema de bombona de calor para agua caliente. Ubicado en el cuarto piso con amplia vista. Edificio cuenta con: Ascensor. Guardianía Privada 24/7. Circuito cerrado de Tv. areas comunales. Terraza. Salón Comunal. Piscina. Ubicación estratégica, a pocos minutos de hospitales, supermercados, farmacias, colegios fácil acceso a todo lo que necesitas. Leopoldo Guzmán. Asesor Inmobiliario. inmobusiness S. A.",./Plusvalia_raw_p18_060924_2243_files/logo_inmobusiness-s.a._1694815287277.jpg,Super destacado
