Precio,Ubicación,Ciudad,Expensas,Habitaciones,Baños,Área,Estacionamientos,Precio/m²,Fecha de Publicación,Descripción,Logo Agencia,Destacado
USD 64.900,"Puente 2, Valle de los Chillos","Los Chillos, Quito",USD 230 Alícuota,2 a 3 hab.,3 baños,75 a 182 m² tot.,2 estac.,N/A,N/A,"Puente 2 sentido quito valle. crédito vip. reserva con $500 yo. pet zone. areas verdes. El proyecto consta de 33 unidades de vivienda. 22 casas y 11 departamentos. El bloque de departamentos es de tres pisos y es un solo bloque. En la terraza contamos con: Area social. Pérgola y en ella un espacio adecuado para bbq. Además las áreas sociales de todo el conjunto. El área social de la terraza, es exclusiva de los departamentos. Excelente ubiocación",./Plusvalia_raw_p5_060924_2243_files/logo_abacoproyec-cia.-ltda._1724090627357.jpg,Super destacado
USD 78.302,Julio Arellano y Malvas,"Norte de Quito, Quito",USD 31 Alícuota,1 a 3 hab.,2 baños,49 a 95 m² tot.,1 estac.,N/A,N/A,"Venta directa del constructor!! Agenda cita con un Asesor Comercial. ""Visita nuestro Departamento Modelo"" características: • Espectacular Proyecto. • Amplios Ventanales, acogedor. • Diseño de vanguardia y único en su clase. • Entrega inmediata. Ubicación: Sector ""Monteserrin"" Cerca de Parques. Centros Comerciales. Entidades Financieras. Supermercados. Colegios y Universidades. Facilidad de acceso y movilización. descripción: • Cuenta con 33 unidades entre ellas suites, departamentos de 2 y 3 dormitorios. • Hermosos departamentos con acabados de primera. Servicios comunales: • Área bbq. • Ascensor de última tecnología. • Generador eléctrico de emergencia. • Áreas Verdes. • Salón Comunal. • Lobby Doble Altura Equipado. • Jacuzzi. • Terraza Chill out. • Espacio Gymboree. • Guardiania 24 horas. • Gimnasio equipado. • Parqueadero de visitas. . Zona Pet friendly. formas de pago: • Crédito biess. • Diferentes Entidades financieras. información Y ventas: Ver datos - Ver datos",./Plusvalia_raw_p5_060924_2243_files/logo_cruz-escalante_4.jpg,Super destacado
USD 66.000,"Calle Vicente Ramón Roca y Miguel Riofrío. Sector La Macarena, también conocido como Santa Mónica Baja en Conocoto.","Los Chillos, Quito",USD 92 Alícuota,3 a 4 hab.,2 baños,37 a 196 m² tot.,1 estac.,N/A,N/A,"El conjunto habitacional más lindo del valle de los chillos sector conocoto. Reserva en el mes de agosto Y te cubrimos todos* los gastos de regreso A clases de tus hijos: listas de útiles, uniformes, etc. * Aplica restricciones. Gracias por su interés en el Conjunto Habitacional La Giralda de la Constructora Mendoza Peña. Financiamiento: Trabajamos en conjunto para aplicar a créditos hipotecarios en cualquier institución financiera de su preferencia, con todas! Ubicación Privilegiada: Rodeado de naturaleza️ A pocos minutos del Centro comercial San Luis Shopping, ️ Centro Comercial River Mall, plazas comerciales, etc. Acceso a transporte público escuelas, universidades, bancos y supermercados. Para su visita en el departamento y casas modelo, le sugerimos hacerlo como paseo familiar ya que contamos con hermosas áreas comunales. Piscina cubierta y temperada con Sauna y Turco. Canchas deportivas. Área de juegos infantiles. ️ Casa comunal. Contamos con varias opciones de vivienda, todas cuentan con mínimo 3 habitaciones, sala, comedor, cocina tipo americana, acabados de primera calidad y hermoso diseño moderno, descúbrelas: Departamentos de 1 sola planta: 90m2 desde $95. 000. Casas de 2 plantas: desde 146 m2 desde $146. 000 (de 3 y 4 dormitorios) Casas de 3 plantas: desde 196m2 desde $198. 000",./Plusvalia_raw_p5_060924_2243_files/logo_constructora-mendoza-pena_1.jpg,Super destacado
USD 176.300,TEOFILO CARRERA Y HERMANOS BRAUER,"Puembo, Quito",,2 a 3 hab.,2 baños,96 a 202 m² tot.,2 estac.,N/A,N/A,"Muskuna: casas Y departamentos en Puembo. nuevo proyecto casas Y departamentos que conforman un conjunto privado y exclusivo rodeado de naturaleza; adicional cuenta con más de 2. 000 m2 de áreas verdes y recreativas. Ubicación: Ubicado en puembo conocido como la ""eterna primavera"" un sector residencial en desarrollo y rodeado de naturaleza y un clima privilegiado. *teofilo carrera Y hermanos brauer (de la Y a mano derecha a 100m). Puembo. entrega: 2025. áreas comunales: - Piscina. - Jacuzzi. - Cancha Pdel. - Game Room. - Juegos Infantiles. - Video vigilancia. - Jardines decorativos. - Laguna. - Garita guardiania. - Sala exterior bbq. - Estacionamiento visitas. contactos: - Ver datos. - Ver datos. - Ver datos",./Plusvalia_raw_p5_060924_2243_files/logo_alvarez-bravo_1612854724270.jpg,Super destacado
USD 55.998,Carlos Guerrero entre Bosmediano y Bossano,"Bellavista, Quito",USD 50 Alícuota,1 a 2 hab.,3 baños,28 a 76 m² tot.,2 estac.,N/A,N/A,"¡adn eres tú! Eres la razón para crear y conceptualizar este moderno proyecto. Es el lugar perfecto para que cumplas tus sueños y comiences a vivir tu vida como siempre lo quisiste. Este proyecto ofrece 4 tipos de departamentos: Apart Studios, Mini Suites, Suites y Departamentos de 2 dormitorios. Sus áreas comunales serán tus aliadas para cumplir todos tus objetivos y tus cómplices para que puedas disfrutar con tu familia y amigos. ¡Conoce más de este increíble proyecto! El proyecto se encuentra ubicado en una zona estratégica en Quito, cerca de líneas de transporte, centros comerciales, espacios de entretenimiento, comercios y centros de salud. El edificio cuenta con cómodos amenities: Gimnasio. Área de coworking. Cabina de grabación. Sala de juegos. Área de lavado. bbq con pérgola. Jacuzzi. Sauna. Turco. Sala comunal. Pet Spa.",./Plusvalia_raw_p5_060924_2243_files/logo_eks-constructora_1517853126764.jpg,Super destacado
USD 63.600,Eloy Alfaro,"Norte de Quito, Quito",USD 1 Alícuota,1 a 3 hab.,2 baños,50 a 71 m² tot.,1 estac.,N/A,N/A,"¡aprovecha los precios en planos de la torre 2! Suites, departamentos de 2 Y 3 dormitorios en plena av. Eloy alfaro A dos cuadras de solca con la mejor vista de quito. No busques más, torres santa catalina lo tiene todo: • parqueaderos subterráneos. • sistema centralizado de agua caliente ecoamigable 24/7. • co-working space. • gimnasio. • pet-zone. • zonas de recreación para niños. • conjunto cerrado Y seguro. • zona bbq. • hermosas terrazas en cada torre. • parque central. • excelente ubicación. • rápido acceso A diferentes puntos de la ciudad. • vista privilegiada. • arquitectura novedosa. • diseño moderno. • amplias áreas verdes. • parqueaderos cubiertos Y bodegas (consultar disponibilidad) • dos ascensores por torre",./Plusvalia_raw_p5_060924_2243_files/logo_geo-promotores_1614962373881.jpg,Super destacado
USD 104.000,Av. Manuela Saenz (Vía Lactea),"Cumbayá, Quito",,1 hab.,2 baños,73 a 113 m² tot.,1 estac.,N/A,N/A,"El Edificio ´´versailles’’ está ubicado en el sector más exclusivo de Cumbayá, vecinos de la Central Hidroeléctrica Cumbayá. ¡no se preocupe por los apagones! Además contamos con generador Propio. Cuenta con Acabados de lujo. Pasillos amplios e iluminados. Gimnasio. Coworking. Galerías de arte. Areas verde. Pista de correr. bbq. Petfriendly. Parqueaderos y bodegas. Cisterna. 1 Ascensor. A 3 minutos del parque de cumbayá A 5 minutos de la universidad san francisco, del paseo san francisco y de los principales bancos del país. A 10 minutos del centro comercial scala y acceso a la ruta viva. A 10 minutos de la avenida simón bolivar y un minuto al acceso directo a udla park. Es uno de los proyectos con menor tráfico y población interna, lo que asegura al cliente un nivel de privacidad superior a otros proyectos de Cumbayá La estructura es de Hormigón Armado sismorresistente y sus paredes internas y externas son hechas de bloque de concreto, permitiendo el bloqueo de sonido exterior. Las cocinas y baños son semi – amobladas. Sus mesones son de granito brasileño importado y los accesorios son de la marca exclusiva fv.",./Plusvalia_raw_p5_060924_2243_files/logo_consultores-latinoamericanos-asociados-conlatinos_1658415339721.jpg,Super destacado
USD 86.766,Granda Centeno -Villalengua,"Quito Tenis, Quito",USD 80 Alícuota,1 a 3 hab.,1 baño,66 a 105 m² tot.,1 estac.,N/A,N/A,"Proyecto nezu cipres es un super moderno y exclusivo edificio de 9 pisos que iniciará su construcción en septiembre de 2023. Está ubicado en el sector de la Granda Centeno-Quito Tennis, uno de los sectores de mayor crecimiento y plusvalía debido a su estratégica ubicación, a pocos minutos del hipercentro de la ciudad pero a la vez en un sector muy residencial, tranquilo y familiar cercano a restaurantes, panaderías, agencias bancarias, colegios, parques etc. Nezu cipres es un edificio sismoresistente y ecoeficiente que contará con: - Vanguardista y elegante diseño interior y exterior. - amplios ventanales que proveen iluminación en todos los ambientes. - cómodos espacios en todas las áreas pensados en el confort del cliente. - finos acabados en todos los espacios. - sistema de seguridad con cámaras. - ascensor de última tecnología con tarjetas magnéticas. - generador eléctrico. - gimnasio y sala de juegos. - terraza comunal apergolada con área de bbq. - hermosa vista de la ciudad. -Sala para Coworking. -área para mascotas. Llena ""ya"" el formulario y te ayudamos con una visita al proyecto. -",./Plusvalia_raw_p5_060924_2243_files/logo_inmoplus_1714065974618.jpg,Destacado
USD 164.827,Quito Tennis-Pedro Gosseal  y mariano echeverria,"Quito Tenis, Quito",USD 140 Alícuota,2 a 3 hab.,2 baños,113 a 204 m² tot.,2 estac.,N/A,N/A,"Inmobiliaria Inmoplus pone a tu disposición el edificio suances un super moderno y exclusivo edificio de 4 pisos con 12 departamentos de 2 y 3 dormitorio y departamentos dúplex. Está ubicado en el mejor sector del Quito Tennis, uno de los sectores de mayor crecimiento y plusvalía debido a su estratégica ubicación, a pocos minutos del hipercentro de la ciudad pero a la vez en un sector muy residencial, tranquilo y familiar cercano a restaurantes, panaderías, agencias bancarias, colegios, parques etc. El edificio suances es un edificio sismoresistente que contará con: - Generador eléctrico. - Elegante y moderno diseño interior y exterior. - amplios ventanales que proveen iluminación en todos los ambientes. - cómodos espacios en todas las áreas pensados en el confort del cliente. - finos acabados en todos los espacios. - sistema de seguridad con cámaras. - ascensor de última tecnología con tarjetas magnéticas. - gimnasio. -Sala de reuniones. - terraza comunal con área de bbq. - hermosa vista de la ciudad. -área para mascotas. Llena ""ya"" el formulario y te ayudamos con una visita al proyecto.",./Plusvalia_raw_p5_060924_2243_files/logo_inmoplus_1714065974618.jpg,Destacado
USD 126.900,EDIFICIO BALCO / SECTOR GRANDA CENTENO,"Granda Centeno, Quito",,2 hab.,2 baños,84 a 98 m² tot.,2 estac.,N/A,N/A,"Balco es un Edificio Residencial Familiar de 4 pisos que está conformado por 1 local, 2 suites, 6 apartamentos, además de un subsuelo donde se encuentran los parqueaderos y las bodegas. Los departamentos cuentan con entrada de luz natural que permite ver la ciudad o el Volcán Pichincha. Ubicado en la Sancho de Escobar y Granda Centeno, un sector en el cual encontramos comercios, zonas recreativas, instituciones educativas, de salud y financieras a pocos minutos. Departamentos. • 1&2 Habitaciones. • 2 Baños completos. • 1&2 Parqueadero. • Cuarto de máquinas. • Bodega. • Terraza. • Walking closet. • Cocina estilo americano. • Mesones de cuarzo. • Puntos de iluminación led. • Baños y grifería fv/Briggs o similar. • Estructura metálica sismo resistente. • Citófono. • Ascensor. terraza. • Jardines. • Butacas. • Iluminación. • Zona de bbq. • Pérgola",./Plusvalia_raw_p5_060924_2243_files/logo_biga-inteligencia-constructiva_1714594182117.jpg,Destacado
USD 196.000,Av. del Parque y Calle 2,"El Bosque , Quito",USD 50 Alícuota,2 hab.,3 baños,320 m² tot.,2 estac.,N/A,N/A,"Este departamento está ubicado en la parte posterior del Centro Comercial El Bosque, dentro del conjunto llamado ""terrazas del bosque"" Son varias torres de 4 pisos cada una. El Conjunto tiene un acceso peatonal y otro de doble vía para el acceso vehicular. Es un conjunto muy seguro con guardiania privada todos los dias de la semana. Cuenta además con una cerca eléctrica y un circuito de cámaras de video. El departamento tiene 150 m2 de construcción útiles, mas áreas verdes de 170 m2 propios del departamento. Está orientado hacia el este, recibe el sol de la mañana, dándole una temperatura agradable en todo el departamento. Sala y comedor con amplia entrada de sol y salida directa al jardín. Amplia cocina independiente con espacio para comedor del diario. Area de máquinas y baño de servicio. También se puede accesar al jardín desde los dormitorios. Tiene 2 dormitorios, con espacio para un dormitorio mas en caso de requerirlo, con acceso directo a las áreas verdes. En pleno jardín se puede disfrutar de un jacuzzi, rodeado de plantas y hermosas áreas verdes. Un árbol alto y frondoso proporciona con sus hojas una amplia sombra. A un lado se tiene una bodega de 25 m2 con la forma de una mini casa al estilo de una ""casita de muñecas"" Estos espacios verdes son muy importantes y funcionales para que los niños puedan recrearse y jugar con sus mascotas. Disfruta de vivir como si estuvieras en una casa, pero con la seguridad de un edificio.",./Plusvalia_raw_p5_060924_2243_files/logo_vivre-bienes-raices_1659031441683.jpg,Super destacado
USD 150.000,Colegio La Dolorosa,"Centro de Quito, Quito",USD 407 Alícuota,3 hab.,4 baños,146 m² tot.,3 estac.,N/A,N/A,"Inmobusiness presenta para la venta departamento en Quito por el sector del Colegio La Dolorosa. El departamento se encuentra en un primer piso alto de edificio de 5 departamentos. Sus espacios son cómodos y bien distribuidos dando privacidad al area de los dormitorios del resto de las areas. El piso es de tablón y en las areas sociales luce muy bien las cenefas decorativas de yeso. Tanto la cocina como los baños han sido remodelados con acabados de excelente calidad y cuentan con tuberías de cobre y la puerta principal de ingreso al departamento es blindada. La excelente ubicacion del departamento permite que a pocos pasos se conecte con principales avenidas de la ciudad asi como buen acceso a transporte publico y al túnel de Guayasamín que conecta con el Valle de Tumbaco. Muy cerca de centros comerciales, bancarios, educativos y de principales areas verdes como el Parque de La Carolina. 146 m2 de construcción. Características: Sala. Comedor. Estudio. Baño Social. Cocina con desayunador de diario, plancha, extractor y horno eléctrico. Dormitorio Master con walk in closet y baño completo. 2 Dormitorios con closet que comparten baño. Area familiar. 1 Estacionamiento. 1 bodega. Calentamiento de agua es a gas. Edificio con cerco eléctrico y cámaras. Guardiania virtual 24 horas. Inmobusiness te invita a conocer esta propiedad. Yamile Dager. Asesor Inmobiliario",./Plusvalia_raw_p5_060924_2243_files/logo_inmobusiness-s.a._1694815287277.jpg,Super destacado
USD 110.000,12 de octubre,"12 de Octubre, Quito",USD 73 Alícuota,2 hab.,2 baños,82 m² tot.,2 estac.,N/A,N/A,"Área de construcción cubierta: 82. 38 m2. 2 habitaciones: Máster con baño completo. Habitación auxiliar. Baño social completo. Sala/Comedor. Cocina estilo americana. Todas las áreas y habitaciones tienen entrada de luz natural. Características: Urbanización privada. Área de servicio. Área de lavandería. Puertas eléctricas. Alarma. Áreas húmedas. Business center. Sala de reuniones. 1 parqueadero. 1 bodega. Gimnasio. Terraza con área bbq. Salón comunal. Video vigilancia. Se aceptan mascotas. Estacionamiento para visitas. Hermoso y moderno departamento de oportunidad. Ubicado en el norte de Quito con vista panorámica. Cuenta con ubicación estratégica, a una cuadra de la 12 de octubre, cerca del Megamaxi, farmacias, universidades, hospitales, entidades financieras como el Banco del Pichincha fácil acceso al transporte público. Este departamento ofrece una experiencia de vida única que cumplirá con todas tus expectativas.",./Plusvalia_raw_p5_060924_2243_files/logo_inmobusiness-s.a._1694815287277.jpg,Super destacado
USD 225.000,Miravalle 4,"Cumbayá, Quito",USD 158 Alícuota,2 hab.,2 baños,172 m² tot.,2 estac.,N/A,N/A,"108 m2 Área construcción. 9 m2 Balcón cubierto. 55 m2 Terraza exclusiva. 172 m2 area total. Luminoso Pent House de 2 dormitorios con una espectacular vista del Valle de Cumbayá. Se encuentra ubicado en urbanización privada con guardianÍa y seguridad integrada 24/7. Vinculado al sti (Sistema de Tráfico Inteligente), que permite salir por la ruta interna de las Miravalles de forma rápida en apenas 3 minutos. Forma parte de un edificio moderno con acabados de alta gama. Cien por ciento eléctrico, funciona con bombas de calor. Cuenta con una terraza exclusiva privada. Se encuentra a pocos minutos de Quito, centros educativos y de recreación, comerciales, financieros, hospitales y facilidades de transporte público. Características. 1 Dormitorio Master con walk in closet y baño. 1 Dormitorio con clóset y baño completo. Sala Comedor. Cocina abierta estilo americano. 1 Baño social. Área de lavandería. Terraza exclusiva. 2 Estacionamientos cubiertos. 1 bodega. Área de Lavandería. Servicios Comunales. Área Interna con salón comunal. Área comunal externa en terraza con bbq. Ascensor. Guardianía 24 horas. Canchas deportivas polifuncionales. Áreas verdes. asesora inmobiliaria. Consuelo Muñoz. Inmobusiness",./Plusvalia_raw_p5_060924_2243_files/logo_inmobusiness-s.a._1694815287277.jpg,Super destacado
USD 139.500,Juan Arauz y Vicente Heredia,"Calderón, Quito",USD 20 Alícuota,2 hab.,2 baños,214 m² tot.,1 estac.,N/A,N/A,"Cbr. Magdalena González. 0-9-8-4-5-3-6-2-0-4. re/max Capital. Pongo a su disposición. Un Departamento con Terraza Cubierta. Ubicado en el Barrio San Fernando al Norte de Quito. Distribuido de la siguiente manera: Área de Sala y Comedor en un solo ambiente con puerta de aluminio y vidrio que se integra a la terraza proporcionando un ambiente social muy amplio. Terraza de 80 m2 cubierta en L con pérgola de madera y vidrio laminado. Protección vertical de vidrio templado. Cocina cerrada con espacios grandes para usar un comedor de diario. Habitación de servicio con baño completo que puede ser un estudio. Área de máquinas cerrada con conexiones para lavadora y secadora, una piedra de lavar. Un baño completo compartido con social. Dos habitaciones con closet que comparten el baño. Una habitación máster con closet y baño completo con salida a la terraza. Sala de estar con salida también a la terraza. Bodega ubicada en el jardín comunal posterior del edificio. Condominio del edificio $50 por mantenimiento general y luz comunal más consumo de agua comunal. Puerta para Control de ingreso a la cuadra con Guardianía se pagan $25. El departamento tiene: Calefón a gas ubicado en terraza exterior. Medidor de luz independiente. Contador de agua para cobro de consumo de cada departamento. Parqueaderos frontales e independientes. Excelente ubicación cerca de todo. A dos cuadras sobre la Av. Occidental. Justo detrás del Conjunto Ciudad Occidente. Cerca de Centros comerciales, Supermercados, Paradas de Buses y demás comercios. Ubicación. Juan Arauz y Vicente Heredia",./Plusvalia_raw_p5_060924_2243_files/logo_remax-capital_1713196405746.jpg,Super destacado
USD 76.635,Sector Solca,"Solca, Quito",,2 hab.,2 baños,81 m² tot.,2 estac.,N/A,N/A,"Mv-sector embaja americana, en venta dpto 2D 62 M2 con balcon 3. 59 M2**Aplica créditoHipotecario vip*Fecha de entrega junio del 2025* 5% de entrada y a la firma de la promesa de compra venta y el 95% restante con créditohipotecario **Cerca a la Embajada Americana, colegio Becquerel, Hospital Solca, Sector residencial, fácil acceso a transporte público, edificio con ascensor, área de bbq, Gimnasio, co-working, áreasverdes para mascotas. -61. 98 m2 + Balcón 3. 59 m2-Sala comedor-Cocina estilo americano-2 Dormitorios-2 baños completos-Área de lavandería-1 Parqueadero-1 BodegaPrecio de venta: $76. 635 ""A un click de tu nuevo hogar""",./Plusvalia_raw_p5_060924_2243_files/logo_miroeslada-vallejo-noboa_1581971666237.jpg,Super destacado
USD 143.243,Tumbaco,"Tumbaco, Quito",USD 47 Alícuota,1 hab.,2 baños,87 m² tot.,2 estac.,N/A,N/A,"Área Total: 87, 34 m² (78, 49 m² interiores y 8, 85 m² de terraza) Precio desde: $143, 243Áreas Comunes: Zona bbqsala comunal amobladaJuegos infantilesJacuzziEspacio de coworkingGimnasioAmplios jardinesVentajas: Seguridad 24 horasUbicado en una urbanización cerrada con fácil acceso a vías principalesFechas de Entrega: Etapa 1: Marzo 2025Etapa 2: Julio 2026Etapa 3: Diciembre 2026Aprovecha la oportunidad de adquirir un moderno departamento de 2 dormitorios en nuestro nuevo proyecto en Tumbaco. Para más información y consultas, contáctanos hoy mismo. ¡Tu nuevo hogar en Tumbaco te espera!",./Plusvalia_raw_p5_060924_2243_files/logo_grupo-3-inversiones_6.jpg,Super destacado
USD 120.000,AV. Republica DEL Salvador  Y Moscu,"La Carolina, Quito",USD 170 Alícuota,2 hab.,1 baño,67 m² tot.,2 estac.,N/A,N/A,"Mv - av. Republica del salvador Y moscu, en venta suite con vista 52 m2 ideal para inversion Y airb&amp;amp;B. Sector residencial de alta plusvalía, ideal para inversión, a pocos metros del Parque la Carolina, cerca a restaurantes, supermercados. Centros comerciales, fácil acceso a transporte públicoEl Edificio cuenta con bbq, jacuzzi, salón de juegos, gimnasio y seguridad privada. - 52. 86 m2 habitables-1 dormitorio- Cocina estilo americano - Sala comedor - Área lavandería- 1 baño completo - baño social- 1 parqueadero - 1 bodega- 6 años de antigüedad Valor de venta $120. 000 Valor de alícuota de $80 &quot;A un click de tu nuevo hogar&quot;",./Plusvalia_raw_p5_060924_2243_files/logo_miroeslada-vallejo-noboa_1581971666237.jpg,Super destacado
USD 199.000,Edificio St Marcus Cumbaya,"Cumbayá, Quito",USD 38 Alícuota,3 hab.,2 baños,120 m² tot.,1 estac.,N/A,N/A,"Vendo departamento Cumbayá nuevo por estrenar. Hermosa vista desde todos los rincones! Edificio con Piscina, Gym, Terraza bbq y Seguridad 24 horas. * Área: 120 m2. * 2 Dormitorios amplios con baños completos cada uno. * Sala de estar / Estudio. * Sala y comedor con vista. * Cocina tipo americano equipada con plancha, horno y extractor. * Baño social y área de máquinas. * Parqueaderos: 2. * Bodegas: 1. Seguridad 24 horas, 2 ascensores (acceso con tarjetas) Facilidad de accesos, ubicado en un sector super residencial y tranquilo. A 3 minutos del Scala, a 5 minutos del Paseo San Francisco.",./Plusvalia_raw_p5_060924_2243_files/logo_dinmo-inmobiliaria_1569885872048.jpg,Super destacado
USD 149.900,"Sector Brasil, Nuevo Supermaxi","Quito Tenis, Quito",USD 155 Alícuota,4 hab.,2 Baños,140 m² tot.,2 estac.,N/A,N/A,"Departamento en venta de 3 dormitorios en Quito, sector CinemarkHermoso departamento remodelado de 140 m23 dormitorios2, 5 bañosEstudioCocina remodeladausd 149. 900Espectacular iluminación natural Área de maquinas y zona de servicioAmplia bodega de 21 m22 parqueaderosAscensorLinda área comunal¡Tu mejor oportunidad en la zona más central de Quito!",./Plusvalia_raw_p5_060924_2243_files/logo_grupo-3-inversiones_6.jpg,Super destacado
USD 159.963,Guillermo Mensi,"Solca, Quito",,3 hab.,2 Baños,236 m² tot.,N/A,N/A,N/A,"Hermoso departamento 4 habitaciones de oportunidad. Muy bien ubicado a lado del Megakiwi Solca totalmente remodelado, equipado con tecnología de punta luminarias, domótica, interruptores touch. y Alexa en un segundo piso. - 4 habitaciones una de ellas con cama empotrada. - habitacion master con tina y bañera. - 3 baños completos con muebles de granito. - cuarto de estudio con mobiliario completo. - sala de estar. - baño social. - amplia sala con chimenea y comedor con piso flotante de alto tráfico. - cocina y cuarto de máquinas. - 2 parqueos. - una bodega. - puerta principal blindada. El departamento se encuentra en un pasaje super seguro con guardia. presencial las 24 horas y cuenta con un parque infantil privado. -",./Plusvalia_raw_p5_060924_2243_files/logo_inmoimpakto-inmobiliaria_1606316253342.jpg,Super destacado
